{
  "$schema": "https://json-schema.org/draft/2020-12/schema",
  "$id": "https://compatforge.dev/schemas/launch-plan.schema.json",
  "title": "CompatForge Compiled Launch Plan",
  "type": "object",
  "additionalProperties": false,
  "required": ["schemaVersion", "requestId", "runtime", "translator", "graphics", "process", "sandbox", "lifecycle"],
  "properties": {
    "schemaVersion": { "const": "1" },
    "requestId": { "type": "string", "format": "uuid" },
    "runtime": {
      "type": "object",
      "additionalProperties": false,
      "required": ["provider", "packId", "packDigest"],
      "properties": {
        "provider": { "enum": ["wine", "virtual-machine", "remote"] },
        "packId": { "$ref": "#/$defs/id" },
        "packDigest": { "$ref": "#/$defs/digest" }
      }
    },
    "translator": {
      "type": "object",
      "additionalProperties": false,
      "required": ["provider"],
      "properties": {
        "provider": { "enum": ["native", "rosetta", "fex", "box64", "qemu", "remote"] },
        "version": { "type": "string" }
      }
    },
    "graphics": {
      "type": "object",
      "additionalProperties": false,
      "required": ["backend"],
      "properties": {
        "backend": { "enum": ["wined3d", "dxvk", "vkd3d-proton", "d3dmetal", "moltenvk", "virtualized", "remote"] },
        "version": { "type": "string" },
        "options": {
          "type": "object",
          "additionalProperties": { "type": ["string", "boolean", "number"] }
        }
      }
    },
    "process": {
      "type": "object",
      "additionalProperties": false,
      "required": ["executable", "arguments", "environment", "workingDirectory"],
      "properties": {
        "executable": { "type": "string", "minLength": 1 },
        "arguments": { "type": "array", "items": { "type": "string" } },
        "environment": {
          "type": "object",
          "additionalProperties": { "type": "string" }
        },
        "workingDirectory": { "type": "string", "minLength": 1 }
      }
    },
    "guestArtifact": { "$ref": "guest-artifact.schema.json" },
    "mounts": {
      "type": "array",
      "items": {
        "type": "object",
        "additionalProperties": false,
        "required": ["source", "destination", "access"],
        "properties": {
          "source": { "type": "string", "minLength": 1 },
          "destination": { "type": "string", "minLength": 1 },
          "access": { "enum": ["read-only", "read-write"] }
        }
      }
    },
    "sandbox": {
      "type": "object",
      "additionalProperties": false,
      "required": ["profile", "network"],
      "properties": {
        "profile": { "enum": ["strict", "desktop", "game", "developer", "unconfined"] },
        "network": { "enum": ["deny", "installer-only", "allow"] },
        "allowDevices": { "type": "array", "items": { "type": "string" } }
      }
    },
    "lifecycle": {
      "type": "object",
      "additionalProperties": false,
      "required": ["terminationGraceMilliseconds"],
      "properties": {
        "terminationGraceMilliseconds": { "type": "integer", "minimum": 1, "maximum": 60000 },
        "maximumRuntimeMilliseconds": { "type": "integer", "minimum": 1, "maximum": 604800000 },
        "wineserver": {
          "type": "object",
          "additionalProperties": false,
          "required": ["executable", "prefix"],
          "properties": {
            "executable": { "type": "string", "minLength": 1 },
            "prefix": { "type": "string", "minLength": 1 }
          }
        }
      }
    },
    "decisionTrace": {
      "type": "array",
      "items": { "type": "string" }
    }
  },
  "$defs": {
    "id": { "type": "string", "pattern": "^[a-z0-9][a-z0-9._-]+$" },
    "digest": { "type": "string", "pattern": "^sha256:[a-fA-F0-9]{64}$" }
  }
}
