{
  "decisionTrace": [
    "legacy Bottle launcher mapped to verified preview Runtime Pack",
    "environment merge uses launcher override precedence"
  ],
  "graphics": {
    "backend": "wined3d",
    "options": {},
    "version": "fixture-preview"
  },
  "lifecycle": {
    "maximumRuntimeMilliseconds": 600000,
    "terminationGraceMilliseconds": 3000
  },
  "process": {
    "arguments": [
      "drive_c/Public/Legacy.exe"
    ],
    "environment": {},
    "executable": "/compatforge/runtime/bin/wine",
    "workingDirectory": "/compatforge/bottles/bottle-win32/prefix"
  },
  "requestId": "018fe3cb-9d12-7b52-b334-1cce0e857fca",
  "runtime": {
    "packDigest": "sha256:b7e18e933c0a51f6f1ec387862793e5d22cc2edb7e23c114449ea98357d717af",
    "packId": "fixture-runtime",
    "provider": "wine"
  },
  "sandbox": {
    "allowDevices": [],
    "network": "deny",
    "profile": "strict"
  },
  "schemaVersion": "1",
  "translator": {
    "provider": "native",
    "version": "fixture-preview"
  }
}
